{
  "schema_version": "1.0",
  "generated_at": "2026-03-08T14:35:48+00:00",
  "benchmark_id": "api-auth-skill-release-coverage-20260308",
  "skills_compared": {
    "candidate_a": "generated-skill-v2",
    "candidate_b": "single-source-baseline"
  },
  "model": "claude-opus-4.6",
  "judge_model": "claude-opus-4.6",
  "agent_surface": "copilot-cli",
  "trial_count": 5,
  "case_count": 10,
  "mean_delta": 0.8,
  "win_rate": 0.8,
  "candidate_a_win_rate": 0.8,
  "candidate_b_win_rate": 0.0,
  "tie_rate": 0.2,
  "confidence_interval_95": [
    0.5,
    1.0
  ],
  "efficacy_breakdown": {
    "invoked-task": 1.0,
    "hard-negative": 0.0,
    "boundary": 1.0
  },
  "activation_metrics": {
    "candidate_a": {
      "precision": 1.0,
      "recall": 1.0,
      "false_positive_rate": 0.0,
      "false_negative_rate": 0.0,
      "ambiguous_trigger_rate": 1.0
    },
    "candidate_b": {
      "precision": 1.0,
      "recall": 1.0,
      "false_positive_rate": 0.0,
      "false_negative_rate": 0.0,
      "ambiguous_trigger_rate": 1.0
    }
  },
  "safety_metrics": {
    "candidate_a_violation_rate": 0.0,
    "candidate_b_violation_rate": 0.0,
    "regression": false
  },
  "cost_metrics": {
    "candidate_a_mean_runtime_ms": 17739.990873336792,
    "candidate_b_mean_runtime_ms": 18359.545912742615,
    "candidate_a_mean_estimated_usd": null,
    "candidate_b_mean_estimated_usd": null
  },
  "verdict": "candidate_a",
  "ranking_eligible": true,
  "decision_eligible": true,
  "activation_gate_passed": {
    "candidate_a": true,
    "candidate_b": true,
    "winner": true
  },
  "schema_validation_passed": true,
  "invalid_trial_policy_applied": true,
  "valid_trials": {
    "candidate_a": 50,
    "candidate_b": 50
  },
  "invalid_trials": {
    "candidate_a": 0,
    "candidate_b": 0
  },
  "replay_evidence_present": false,
  "terminal_status": "completed",
  "limitations": []
}